{
  "models": [
    {
      "domain": "CLSVShare/item_table",
      "fields": [
        {
          "column_id": "c0001",
          "name": "C0001",
          "nullable": false,
          "role": "identity-component",
          "source_type": "int64",
          "storage_type": "uint64"
        },
        {
          "column_id": "c0002",
          "name": "C0002",
          "nullable": false,
          "role": "value",
          "source_type": "string",
          "storage_type": "utf8-string"
        },
        {
          "column_id": "c0003",
          "name": "C0003",
          "nullable": true,
          "role": "value",
          "source_type": "string",
          "storage_type": "utf8-string"
        },
        {
          "column_id": "c0004",
          "name": "C0004",
          "nullable": false,
          "role": "value",
          "source_type": "string",
          "storage_type": "utf8-string"
        },
        {
          "column_id": "c0005",
          "name": "C0005",
          "nullable": false,
          "role": "value",
          "source_type": "int64",
          "storage_type": "int64"
        },
        {
          "column_id": "c0006",
          "name": "C0006",
          "nullable": false,
          "role": "value",
          "source_type": "int64",
          "storage_type": "int64"
        },
        {
          "column_id": "c0007",
          "name": "C0007",
          "nullable": true,
          "role": "value",
          "source_type": "int64",
          "storage_type": "int64"
        },
        {
          "column_id": "c0008",
          "name": "C0008",
          "nullable": false,
          "role": "value",
          "source_type": "string",
          "storage_type": "utf8-string"
        },
        {
          "column_id": "c0009",
          "name": "C0009",
          "nullable": true,
          "role": "value",
          "source_type": "string",
          "storage_type": "utf8-string"
        },
        {
          "column_id": "c0010",
          "name": "C0010",
          "nullable": true,
          "role": "value",
          "source_type": "int64",
          "storage_type": "int64"
        },
        {
          "column_id": "c0011",
          "name": "C0011",
          "nullable": true,
          "role": "value",
          "source_type": "int64",
          "storage_type": "int64"
        },
        {
          "column_id": "c0012",
          "name": "C0012",
          "nullable": true,
          "role": "value",
          "source_type": "int64",
          "storage_type": "int64"
        },
        {
          "column_id": "c0013",
          "name": "C0013",
          "nullable": true,
          "role": "value",
          "source_type": "int64",
          "storage_type": "int64"
        },
        {
          "column_id": "c0014",
          "name": "C0014",
          "nullable": true,
          "role": "value",
          "source_type": "int64",
          "storage_type": "int64"
        },
        {
          "column_id": "c0015",
          "name": "C0015",
          "nullable": true,
          "role": "value",
          "source_type": "int64",
          "storage_type": "int64"
        },
        {
          "column_id": "c0016",
          "name": "C0016",
          "nullable": true,
          "role": "value",
          "source_type": "int64",
          "storage_type": "int64"
        },
        {
          "column_id": "c0017",
          "name": "C0017",
          "nullable": true,
          "role": "value",
          "source_type": "int64",
          "storage_type": "int64"
        },
        {
          "column_id": "c0018",
          "name": "C0018",
          "nullable": true,
          "role": "value",
          "source_type": "int64",
          "storage_type": "int64"
        },
        {
          "column_id": "c0019",
          "name": "C0019",
          "nullable": true,
          "role": "value",
          "source_type": "int64",
          "storage_type": "int64"
        },
        {
          "column_id": "c0020",
          "name": "C0020",
          "nullable": true,
          "role": "value",
          "source_type": "int64",
          "storage_type": "int64"
        },
        {
          "column_id": "c0021",
          "name": "C0021",
          "nullable": true,
          "role": "value",
          "source_type": "int64",
          "storage_type": "int64"
        },
        {
          "column_id": "c0022",
          "name": "C0022",
          "nullable": false,
          "role": "value",
          "source_type": "int64",
          "storage_type": "int64"
        },
        {
          "column_id": "c0023",
          "name": "C0023",
          "nullable": true,
          "role": "value",
          "source_type": "string",
          "storage_type": "utf8-string"
        },
        {
          "column_id": "c0024",
          "name": "C0024",
          "nullable": true,
          "role": "value",
          "source_type": "decimal",
          "storage_type": "double"
        },
        {
          "column_id": "c0025",
          "name": "C0025",
          "nullable": true,
          "role": "value",
          "source_type": "decimal",
          "storage_type": "double"
        },
        {
          "column_id": "c0026",
          "name": "C0026",
          "nullable": true,
          "role": "value",
          "source_type": "int64",
          "storage_type": "int64"
        },
        {
          "column_id": "c0027",
          "name": "C0027",
          "nullable": true,
          "role": "value",
          "source_type": "decimal",
          "storage_type": "double"
        },
        {
          "column_id": "c0028",
          "name": "C0028",
          "nullable": true,
          "role": "value",
          "source_type": "int64",
          "storage_type": "int64"
        },
        {
          "column_id": "c0029",
          "name": "C0029",
          "nullable": true,
          "role": "value",
          "source_type": "int64",
          "storage_type": "int64"
        },
        {
          "column_id": "c0030",
          "name": "C0030",
          "nullable": true,
          "role": "value",
          "source_type": "int64",
          "storage_type": "int64"
        },
        {
          "column_id": "c0031",
          "name": "C0031",
          "nullable": true,
          "role": "value",
          "source_type": "int64",
          "storage_type": "int64"
        },
        {
          "column_id": "c0032",
          "name": "C0032",
          "nullable": true,
          "role": "value",
          "source_type": "int64",
          "storage_type": "int64"
        },
        {
          "column_id": "c0033",
          "name": "C0033",
          "nullable": true,
          "role": "value",
          "source_type": "int64",
          "storage_type": "int64"
        },
        {
          "column_id": "c0034",
          "name": "C0034",
          "nullable": true,
          "role": "value",
          "source_type": "string",
          "storage_type": "utf8-string"
        },
        {
          "column_id": "c0035",
          "name": "C0035",
          "nullable": true,
          "role": "value",
          "source_type": "string",
          "storage_type": "utf8-string"
        },
        {
          "column_id": "c0036",
          "name": "C0036",
          "nullable": true,
          "role": "value",
          "source_type": "string",
          "storage_type": "utf8-string"
        },
        {
          "column_id": "c0037",
          "name": "C0037",
          "nullable": true,
          "role": "value",
          "source_type": "string",
          "storage_type": "utf8-string"
        },
        {
          "column_id": "c0038",
          "name": "C0038",
          "nullable": true,
          "role": "value",
          "source_type": "string",
          "storage_type": "utf8-string"
        },
        {
          "column_id": "c0039",
          "name": "C0039",
          "nullable": true,
          "role": "value",
          "source_type": "int64",
          "storage_type": "int64"
        },
        {
          "column_id": "c0040",
          "name": "C0040",
          "nullable": true,
          "role": "value",
          "source_type": "decimal",
          "storage_type": "double"
        },
        {
          "column_id": "c0041",
          "name": "C0041",
          "nullable": true,
          "role": "value",
          "source_type": "int64",
          "storage_type": "int64"
        },
        {
          "column_id": "c0042",
          "name": "C0042",
          "nullable": true,
          "role": "value",
          "source_type": "decimal",
          "storage_type": "double"
        },
        {
          "column_id": "c0043",
          "name": "C0043",
          "nullable": true,
          "role": "value",
          "source_type": "decimal",
          "storage_type": "double"
        },
        {
          "column_id": "c0044",
          "name": "C0044",
          "nullable": true,
          "role": "value",
          "source_type": "decimal",
          "storage_type": "double"
        },
        {
          "column_id": "c0045",
          "name": "C0045",
          "nullable": true,
          "role": "value",
          "source_type": "decimal",
          "storage_type": "double"
        },
        {
          "column_id": "c0046",
          "name": "C0046",
          "nullable": true,
          "role": "value",
          "source_type": "int64",
          "storage_type": "int64"
        },
        {
          "column_id": "c0047",
          "name": "C0047",
          "nullable": true,
          "role": "value",
          "source_type": "decimal",
          "storage_type": "double"
        },
        {
          "column_id": "c0048",
          "name": "C0048",
          "nullable": true,
          "role": "value",
          "source_type": "string",
          "storage_type": "utf8-string"
        },
        {
          "column_id": "c0049",